id,datetime,title,content,link,source
3,2020-06-15 18:30:00,星辉娱乐：2019年报被问询 足球俱乐部收入增长点存疑,"星辉娱乐：2019年报被问询，足球俱乐部收入增长点存疑,来源：览富财经网,原创 石惊雷,星辉娱乐：2019年报被问询,足球俱乐部收入增长点存疑,6月14日，创业板对星辉娱乐（300043）发布2019年报问询函，要求其对2019年分季度营收存在的明显区别做出解释。并对公司俱乐部营收大幅增加补充说明业务收入确认时间点和依据等内容。并对公司有息债务借款明细等内容作出详细解释。,分季度营收净利润差距较大,据悉，星辉娱乐目前主要业务包括足球俱乐部业务、游戏业务、玩具业务。公司最为令人关注的就是已获得西班牙足球甲级联赛皇家西班牙人足球俱乐部99.55%的股份，是首家控股欧洲五大联赛顶级俱乐部的A股上市公司。但监管层对星辉娱乐2019年的年报一些疑问。,星辉娱乐2019年分季度实现的营业收入分别为5.1亿元、6.12亿元、9.37亿元、5.35亿元；分季度实现的归属于上市公司股东的净利润分别为3264万元、9327万元、21320万元、-8059万元。问询函中对星辉娱乐2019年第三季度营收净利润大幅上升但第四季度亏损表示高度关注，要求公司作出解释。,要求公司结合行业情况、收入确认和成本费用归集过程，说明是否存在跨期确认收入及跨期结转成本费用的情形，各季度收入、利润不匹配的原因及合理性。请会计师发表意见。,俱乐部收入增长点存疑,2019年内，星辉娱乐披露公司足球俱乐部业务实现收入12.12亿元，同比增长40.59%；实现净利润2.24亿元，同比增长116.14%。其中，电视转播权收入为6.15亿元，同比增长41.50%；球员转会收入为3.97亿元，同比增长52.95%；赞助及广告收入为1.02亿元，同比增长53.25%。,问询函中要求公司补充说明公司各业务收入确认的时点和依据，以及收入确认的内部控制安排。并且说明近3年足球业务俱乐部收入变化情况及其影响因素，以及是否具有可持续性以及对公司未来经营业绩的影响。,另外，由于今年开年新冠疫情爆发，问询函中要求公司说明新冠肺炎疫情对公司足球俱乐部业务已造成的影响，以及对未来生产经营业绩的影响，并充分提示相关风险。最后一点，问询函中要求补充说明公司 2019 年度转让 Borja、Mario 等球员的进展情况及转让款回收情况。病情会计师核查发表意见。,而且公司年报中包括“其他业务—其他”实现收入8401 万元，问询函中要求星辉娱乐补充披露其具体经营内容、业务模式、业务名称、开展情况、营业收入及成本构成等信息。,补充说明有息债务,2019年末，星辉娱乐包括短期借款、一年内到期的非流动负债和长期借款在内的有息债务余额合计204046.62万元，货币资金余额为38437.43万元。,问询函中要求星辉娱乐请补充说明借款的明细，包括但不限于借款方名称、金额、借款期限、利率、是否存在担保或抵质押条件等。,同时，问询函中要求星辉娱乐结合公司业务发展情况测算营运资金需求，说明公司货币资金水平与资金需求是否匹配，是否存在流动性风险，如果是，需要说明将要采取的应对措施。,应收账款58993.93万元,截至2019年，星辉娱乐应收账款账面余额为58993.93万元，累计计提坏账准备3453.06万元。问询函中要求公司结合应收账款账龄、期后回款情况等补充说明坏账准备计提是否充分。,同时因为应收账款数值较大，问询函中要求星辉娱乐补充说明各组合应收账款前五名客户对应的销售情况，包括销售客户名称（报备）、销售收入金额及确认时间、产品或服务内容、相关应收账款账龄及计提的坏账准备、合同约定的回款时间及目前的回款情况。并请会计师核查并发表意见。,商誉减值危机初现,截至2019年，星辉娱乐商誉余额为10.80亿元，本期未计提商誉减值准备，其中2019年10月30日以1元对价转让深圳市畅娱天下科技有限公司，导致公司商誉减值准备减少1445.78万元。,问询函中要求公司结合各并购标的的行业发展形势、盈利能力变化、商誉减值测试选取的具体参数、假设及详细测算过程，说明减值准备计提是否充分和合理。,同时，问询函中要求星辉娱乐结合畅娱天下经营情况，详细说明公司出售其股权的背景及目的、交易价格是否公允，并说明公司转让畅娱天下事项是否履行了相应的审议程序和信息披露义务，并请会计师核查并发表意见。,对于上述问题，问询函中还要求星辉娱乐6 月 19日前将有关说明材料报送我部，同时抄送广东证监局上市公司监管处。,免责声明：自媒体综合提供的内容均源自自媒体，版权归原作者所有，转载请联系原作者并获许可。文章观点仅代表作者本人，不代表新浪立场。若内容涉及投资建议，仅供参考勿作为投资依据。投资有风险，入市需谨慎。,责任编辑：陈志杰",https://finance.sina.com.cn/stock/s/2020-06-15/doc-iirczymk7150771.shtml,sinaStock
4,2020-06-15 18:30:00,安图生物：拟定增募资不超32.8亿元,"新浪财经讯 6月15日消息，安图生物发布定增预案，本次非公开发行股票的募集资金总额不超过32.8亿元。本次募集资金将投向安图生物体外诊断产业园（三期）项目、安图生物诊断仪器产业园之营销网络建设项目以及补充流动资金项目，用于做大做强公司现有主业。,责任编辑：陈志杰",https://finance.sina.com.cn/stock/s/2020-06-15/doc-iirczymk7150616.shtml,sinaStock
5,2020-06-15 18:26:00,中数智汇IPO：应收账款激增 研发费用率显著低于同行,"6月12日，上交所受理北京中数智汇科技股份有限公司（下称“中数智汇”）科创板上市申请。招股书显示，中数智汇拟募资不超过3.77亿元，用于BIdata平台面向智能化应用升级项目、K+金融知识图谱综合服务平台项目和一站式数据管理平台项目。,值得关注的是，中数智汇的毛利率显著高于同行上市公司，公司称系产品及服务很难被完全替代所致，即公司的产品服务具有竞争优势。但有意思的是，中数智汇的研发费用率却显著低于同行，且有走低趋势，公司自称的技术优势从何来？超高的毛利率是靠技术驱动还是靠营销驱动？,毛利率远高于同行,招股书显示，中数智汇的主营业务是金融科技与大数据服务，为客户提供综合查询、风控反欺诈、关联洞察、反洗钱、商业智能和解决方案类服；公司主要通过搭建平台、提供一站式项目的服务盈利。,2017-2019年，中数智汇分别实现营业收入0.7亿元、0.92亿元和 1.32亿元，同比分别增长31.54%和43.54%（2018年和2019年）；分别实现归母净利润0.21亿元、0.31亿元和0.5亿元，同比分别增长46.24%和60.81%（2018年和2019年）。,与此同时，中数智汇的毛利率也节节攀升，2017-2019年的毛利率分别是78.71%、82.15%和82.45%。,值得注意的是，中数智汇的毛利率显著高于同行上市公司。招股书显示，中数智汇将兆日科技、赢时胜和汇金科技作为同行可比公司。2017年，中数智汇的毛利率低于赢时胜，2018年和2019年，中数智汇的毛利率在同行中都是最高，2019年甚至高出第二名的赢时胜9个百分点。,中数智汇解释称，公司与可比上市公司同属于软件与信息技术服务业，并且均以银行为主要客户群体，但由于双方在具体产品及服务的内容、下游行业和业务定位有所不同，使得公司与可比上市公司的毛利率水平亦存在一些的差异。整体来看，受益于公司业态较为新兴，市场上少有能完全替代公司的同类产品及服务，公司毛利率水平高于可比上市公司。,简言之，中数智汇毛利率高于同行的原因是公司业态新兴，产品具有竞争优势。不过，公司的研发费用率却显著低于同行，作为科创公司的中数智汇，是如何在研发投入较小的情况下保持远超同行的毛利率？,研发费用率显著低于同行,招股书显示，中数智汇2017-2019年的研发费用分别为922.62万元、938.98万元和1347.26万元，研发费用占营业收入比例分别为13.19%、10.21%和10.20%，逐年走低，与公司营收增长的趋势背离。,并且，中数智汇的研发费用率也远低于同行上市公司。2017-2019年，同行上市公司的研发费用率均值为23.76%、24.49%和28.29% ，高出中数智汇10个百分点以上。2017年，公司研发费用率略高于汇金科技，2018年和2019年都在同行中垫底。,据公开信息，兆日科技、赢时胜和汇金科技的营收规模比中数智汇大。一般来说，收入规模较小的科创公司，研发费用率较高，但中数智汇是相反状况。,中数智汇称，公司研发费用率低于可比公司均值，这既反映了公司与可比公司具体业务存在差异，对研发投入的需求程度有所不同，也反映了公司作为未上市企业，在融资平台受限的情况下会根据公司自身情况合理安排研发投入水平。,简言之，中数智汇认为研发费用率低于同行的原因是业务有差异、融资受限。不过，这样的解释还有疑问：一是即使公司业务与同行有差异，这是否能让研发费用率相差10个百分点以上？二是融资受限就限制研发投入，那公司自称的技术优势从何而来？又如何在研发费用率显著低于同行的情况下保持高于同行的毛利率？,事实上，中数智汇的业绩更靠营销驱动，这或许能消除上述疑问。招股书显示，2017-2019年，中数智汇的销售费用分别为828.11万元、1246.12万元和1752.85万元，2018 年度、2019 年度，公司销售费用分别同比增长50.48%、40.66%，与营收增速相符；而公司同期研发费用增速与营收增速背离。2017-2019年，中数智汇的销售费用率分别为11.84%、13.55%和13.28%，2018年和2019年超过同期的研发费用率，这都能印证营销比研发更能驱动公司业绩。,值得一提的是，中数智汇营销人员的薪酬远高于研发人员。招股书显示，公司2019年末共有营销人员13名，职工薪酬为876.34万元，人均年薪67.41万元。公司2019年末共有研发人员39名，职工薪酬为1003.69万元，人均年薪25.74万元，不足同期营销人员人均年薪的40%。,激增的应收账款,招股书显示，在业绩和毛利率增长的背后，中数智汇的应收账款也在急剧增长。,2017-2019年各年末，中数智汇应收账款账面金额分别为2770.86万元、4333.79万元和7168.60万元，分别占公司总资产的22.17%、28.86%和35.48%；分别占当期总营收的39.63%、47.12%和54.3%，占比逐年增长。,中数智汇解释称，随着公司业务规模不断扩大，营业收入持续增长，应收账款也合理增长。,那应收账款增长是否合理？2018年和2019年，中数智汇应收账款增速分别为56.42%和65.42%，超过同期营收增速，这说明回款变慢，有可能是客户还款能力变弱；也有可能是公司放宽了信用政策、加大赊销力度；也不排除公司提前确认收入甚至虚增收入等可能。,招股书显示，公司3年以上账龄的应收账款占比大幅提升，2017-2019年的比例分别为0、6.71%和5.22%。,责任编辑：公司观察",https://finance.sina.com.cn/stock/observe/2020-06-15/doc-iirczymk7150107.shtml,sinaStock
6,2020-06-15 18:23:00,晶方科技：大基金减持公司1%股权 减持计划实施完毕,"新浪财经讯 6月15日消息，晶方科技晚间公告，大基金通过集中竞价方式减持公司1%股权，其减持计划已实施完毕。,责任编辑：陈志杰",https://finance.sina.com.cn/roll/2020-06-15/doc-iircuyvi8620150.shtml,sinaStock
7,2020-06-15 18:20:00,广弘控股：关于独立董事辞职的公告,"证券代码：000529          证券简称：广弘控股          公告编号：2020--18,广东广弘控股股份有限公司,关于独立董事辞职的公告,本公司及董事会全体成员保证信息披露的内容真实、准确、完整，没有虚假记载、误导性陈述或重大遗漏。   广东广弘控股股份有限公司（以下简称“公司”）董事会于 2020 年 6 月 15日收到公司独立董事朱列玉先生提交的书面辞职报告，朱列玉先生因任期届满，申请辞去公司第九届董事会独立董事职务及董事会下设各专业委员会委员职务。   朱列玉先生辞去公司独立董事职务后，将导致公司独立董事人数占董事会总人数的比例低于三分之一，根据《公司法》、《关于在上市公司建立独立董事制度的指导意见》和《公司章程》等有关规定，朱列玉先生的辞职申请将在公司股东大会选举产生新任独立董事之日起生效。在此期间，朱列玉先生仍将按照有关法律、法规和《公司章程》的规定继续履行独立董事及董事会 各专业委员会委员的职责。公司董事会将按照有关规定尽快完成独立董事的补选工作。朱列玉先生辞职生效后，将不再担任公司任何职务。   公司董事会对朱列玉先生在职期间为公司发展所做出的贡献表示衷心感谢！   特此公告。,广东广弘控股股份有限公司董事会,2020 年 6 月 16 日,责任编辑：小浪快报",https://finance.sina.com.cn/stock/ggzz/2020-06-15/doc-iirczymk7148889.shtml,sinaStock
8,2020-06-15 18:20:00,沪硅产业现1笔大宗交易 共成交216.30万元,"新浪财经讯 沪硅产业在6月15日，发生1笔大宗交易。,第1笔成交价格为30.90元，成交7.00万股，成交金额216.30万元，买方营业部为中信建投证券股份有限公司北京丹棱街证券营业部，卖方营业部为中信建投证券股份有限公司总公司交易部。,责任编辑：小浪快报",https://finance.sina.com.cn/stock/ggzz/2020-06-15/doc-iirczymk7148868.shtml,sinaStock
9,2020-06-15 18:20:00,"基蛋生物现2笔大宗交易 共成交2,100.00万元","新浪财经讯 基蛋生物在6月15日，发生2笔大宗交易。,第1笔成交价格为35.00元，成交30.00万股，成交金额1,050.00万元，买方营业部为安信证券股份有限公司福建第二分公司，卖方营业部为东方财富证券股份有限公司上海陆家嘴浦东南路证券营业部。,第2笔成交价格为35.00元，成交30.00万股，成交金额1,050.00万元，买方营业部为安信证券股份有限公司福建第二分公司，卖方营业部为中信建投证券股份有限公司上海浦东新区福山路证券营业部。,责任编辑：小浪快报",https://finance.sina.com.cn/stock/ggzz/2020-06-15/doc-iirczymk7148859.shtml,sinaStock
10,2020-06-15 18:20:00,"贵州茅台现1笔大宗交易 共成交1,232.50万元","新浪财经讯 贵州茅台在6月15日，发生1笔大宗交易。,第1笔成交价格为1,450.00元，成交0.85万股，成交金额1,232.50万元，买方营业部为中国银河证券股份有限公司北京学清路证券营业部，卖方营业部为东兴证券股份有限公司重庆邹容路证券营业部。,责任编辑：小浪快报",https://finance.sina.com.cn/stock/ggzz/2020-06-15/doc-iirczymk7148837.shtml,sinaStock
11,2020-06-15 18:20:00,金域医学现1笔大宗交易 共成交295.05万元,"新浪财经讯 金域医学在6月15日，发生1笔大宗交易。,第1笔成交价格为84.30元，成交3.50万股，成交金额295.05万元，买方营业部为中信建投证券股份有限公司总公司交易部，卖方营业部为中信建投证券股份有限公司北京丹棱街证券营业部。,责任编辑：小浪快报",https://finance.sina.com.cn/stock/ggzz/2020-06-15/doc-iirczymk7148825.shtml,sinaStock
12,2020-06-15 18:20:00,兆易创新现1笔大宗交易 共成交215.21万元,"新浪财经讯 兆易创新在6月15日，发生1笔大宗交易。,第1笔成交价格为215.21元，成交1.00万股，成交金额215.21万元，买方营业部为中信建投证券股份有限公司北京丹棱街证券营业部，卖方营业部为招商证券股份有限公司哈尔滨长江路证券营业部。,责任编辑：小浪快报",https://finance.sina.com.cn/stock/ggzz/2020-06-15/doc-iircuyvi8619005.shtml,sinaStock
13,2020-06-15 18:20:00,"祁连山现1笔大宗交易 共成交1,657.00万元","新浪财经讯 祁连山在6月15日，发生1笔大宗交易。,第1笔成交价格为16.57元，成交100.00万股，成交金额1,657.00万元，买方营业部为华泰证券股份有限公司总部，卖方营业部为中信证券股份有限公司广州临江大道证券营业部。,责任编辑：小浪快报",https://finance.sina.com.cn/stock/ggzz/2020-06-15/doc-iircuyvi8618993.shtml,sinaStock
14,2020-06-15 18:20:00,华懋科技现1笔大宗交易 共成交208.20万元,"新浪财经讯 华懋科技在6月15日，发生1笔大宗交易。,第1笔成交价格为13.88元，成交15.00万股，成交金额208.20万元，买方营业部为光大证券股份有限公司厦门展鸿路金融中心大厦证券营业部，卖方营业部为平安证券股份有限公司厦门国际金融中心证券营业部。,责任编辑：小浪快报",https://finance.sina.com.cn/stock/ggzz/2020-06-15/doc-iirczymk7148769.shtml,sinaStock
15,2020-06-15 18:20:00,昆药集团现1笔大宗交易 共成交961.00万元,"新浪财经讯 昆药集团在6月15日，发生1笔大宗交易。,第1笔成交价格为9.61元，成交100.00万股，成交金额961.00万元，买方营业部为华泰证券股份有限公司总部，卖方营业部为中信证券股份有限公司广州临江大道证券营业部。,责任编辑：小浪快报",https://finance.sina.com.cn/stock/ggzz/2020-06-15/doc-iirczymk7148749.shtml,sinaStock
16,2020-06-15 18:20:00,"三星医疗现1笔大宗交易 共成交2,932.60万元","新浪财经讯 三星医疗在6月15日，发生1笔大宗交易。,第1笔成交价格为6.82元，成交430.00万股，成交金额2,932.60万元，买方营业部为中信建投证券股份有限公司北京玉泉路证券营业部，卖方营业部为中信证券股份有限公司北京金融大街证券营业部。,责任编辑：小浪快报",https://finance.sina.com.cn/stock/ggzz/2020-06-15/doc-iircuyvi8618964.shtml,sinaStock
17,2020-06-15 18:20:00,"海通证券现1笔大宗交易 共成交1,176.00万元","新浪财经讯 海通证券在6月15日，发生1笔大宗交易。,第1笔成交价格为11.76元，成交100.00万股，成交金额1,176.00万元，买方营业部为华泰证券股份有限公司总部，卖方营业部为中信证券股份有限公司广州临江大道证券营业部。,责任编辑：小浪快报",https://finance.sina.com.cn/stock/ggzz/2020-06-15/doc-iirczymk7148722.shtml,sinaStock
18,2020-06-15 18:20:00,"中国联通现1笔大宗交易 共成交2,435.00万元","新浪财经讯 中国联通在6月15日，发生1笔大宗交易。,第1笔成交价格为4.87元，成交500.00万股，成交金额2,435.00万元，买方营业部为华泰证券股份有限公司总部，卖方营业部为中信证券股份有限公司广州临江大道证券营业部。,责任编辑：小浪快报",https://finance.sina.com.cn/stock/ggzz/2020-06-15/doc-iirczymk7148714.shtml,sinaStock
19,2020-06-15 18:20:00,ST狮头现1笔大宗交易 共成交342.00万元,"新浪财经讯 ST狮头在6月15日，发生1笔大宗交易。,第1笔成交价格为6.84元，成交50.00万股，成交金额342.00万元，买方营业部为华福证券有限责任公司上海浦建路证券营业部，卖方营业部为国盛证券有限责任公司上海浦东新区世纪大道证券营业部。,责任编辑：小浪快报",https://finance.sina.com.cn/stock/ggzz/2020-06-15/doc-iircuyvi8618934.shtml,sinaStock
20,2020-06-15 18:18:00,ST亚星：拟终止重大资产重组,"新浪财经讯 6月15日消息，ST亚星晚间公告，公司拟终止筹划重大资产置换及发行股份购买山东宏济堂制药集团、山东科源制药100%股份并募集配资事项。公司目前仍需与各交易相关方继续落实并协商相关事宜，待与各交易方履行完备终止协议的签署和审批、决策程序后，公司将及时披露终止重组的相关公告。,责任编辑：陈志杰",https://finance.sina.com.cn/stock/s/2020-06-15/doc-iirczymk7148449.shtml,sinaStock
21,2020-06-15 18:17:00,三文鱼概念股不跌反涨？是何原因,"炒股就看金麒麟分析师研报，权威，专业，及时，全面，助您挖掘潜力主题机会！,来源：财联社,研究员 张浩月,近日，北京连日新增多例本土病例，均有新发地农产品批发市场活动史，随后，在相关部门的现场检测中，切割进口三文鱼的案板中检测到了新冠病毒。,受此影响，早盘三文鱼概念股集体低开，但随后板块逐渐拉升。截至收盘，板块内多只个股翻红，獐子岛（维权）更是以涨停收盘。消息面上，已有国联水产、通威股份等公司表示三文鱼在自身业务中占比较小，预计不会受到影响。,6月13日凌晨（金麒麟分析师），北京新发地批发市场董事长张玉玺接受媒体采访时说：“相关部门抽检时从切割进口三文鱼的案板中检测到了新冠病毒，而该产品的货源来自京深海鲜市场。”各大商超、餐厅闻风而动，连夜迅速下架三文鱼及其相关产品。多地监管部门紧急开展食品安全排查工作。,多家水产公司就三文鱼事件做出回应,6月14日，国联水产证代陈永文回复称，此次因疫情引发的三文鱼事件不会对公司的生产经营造成直接影响，主要是目前公司三文鱼在总营收占比非常小，可以忽略不计。通过19年财务数据来看，三文鱼的全年销售收入占总收入比例不超过0.05%。公司以对虾、小龙虾为代表的虾类收入占比超过90%。,同日，通威股份也表示，公司当前主要以淡水料为主，基本无三文鱼料；通威与三文鱼有关的主要业务是三文鱼养殖的研究、科研，本次三文鱼下架对通威并无影响。,佳沃股份董秘杨振也向媒体表示，此次北京新发地疫情，将使国内三文鱼产业面临新一轮重构，但长期增长态势不变。其中，传统三文鱼集贸具有开放式作业、人员流动大、接触面广、安全卫生难以保障，无法溯源等特点，这些问题暴露明显。预计此后具备国家认可生食加工资质、安全卫生管控严格、封闭来源去向可追溯等特点的大型市场参与主体将面临发展机遇，产业升级提速势在必行。,三文鱼或为替罪羊 传播源另有“其人”,有病毒学专家称：“新冠病毒的宿主为哺乳类动物，三文鱼和海鲜不是新冠病毒的宿主，不会感染病毒，体内不会潜伏新冠病毒。但是表面可能会因为环境而存在病毒。”三文鱼可能只是作为一种附着的载体或介质，病毒是在加工、运输链条上存活并导致传播。,据广州港集团最新通报，6月13日，市、区两级疾控中心突击抽检黄沙片区各水产批发市场约30多个批发零售档销售的进口三文鱼等食品样、环境样共计71个样品。根据区疾控中心的反馈，全部样品核酸检测结果均为阴性。,6月14日，北京市疾控中心新冠肺炎疫情防控专家组成员杨鹏在接受央视采访时表示，通过全基因组测序发现病毒是从欧洲方向来的，初步判定与输入性有关。但病毒到底怎么来的，还无法确定。有可能是污染的海产品或肉类，或者进入市场的人通过分泌物进行传播。,国内水产品加快进口替代,目前关于三文鱼切割案板的病毒来源还未确定，但市场已经认识到三文鱼等生食食品特别是来源于疫情爆发的进口水产品、冷鲜食品的潜在病毒感染风险。国海证券表示，中长期来看，国内疫情控制较好而国外疫情此起彼伏，或使得国内水产品加快进口替代进程，建议关注国联水产，百洋股份，好当家。,责任编辑：陈志杰",https://finance.sina.com.cn/stock/hyyj/2020-06-15/doc-iirczymk7149892.shtml,sinaStock
