id,datetime,title,content,link,source
15,2020-06-15 20:12:00,收购子公司炸雷：实控人割韭菜 华讯方舟拉响退市警报,"原标题：收购子公司炸雷，实控人掏空“割韭菜”，华讯方舟拉响退市警报,记者 陈祺欣,华讯方舟（000687.SZ）于6月14日晚披露了2019年年报后，目前正处于停牌中，公司股票自明日（6月16日）复牌起将被实施退市风险警示，股票简称由“华讯方舟”变更为“*ST华讯”。,同时，审计机构对华讯方舟2019年年报出具无法表示意见的审计报告，公司独立董事曹健、谢维信对华讯方舟2019年年度报告内容的真实性、准确性、完整性无法保证。,今年以来，华讯方舟的股价也是一路下挫。截至6月12日，其收盘价为3.36元/股，年初至今跌幅达50%。,业绩巨亏之余，华讯方舟还深陷债务逾期、诉讼缠身、被监管批评等诸多麻烦之中，与此同时，公司高管相继离职，控股股东欲转让股权离场给这家企业“雪上加霜”，仁东集团会顺利取得华讯方舟的控股权吗？,收购炸雷，两年巨亏,2019年，华讯方舟实现营业收入2.5亿元，同比下降83.51%；净利润亏损15.21亿元，同比下降208.63%；2018年华讯方舟净利润亏损4.93亿元，由于连续两年经审计的净利润为负值，且截至2019年12月31日，公司经审计的净资产为-4.81亿元，华讯方舟股票将被实行退市风险警示处理。,公开资料显示，华讯方舟是专业从事军事通信应用领域相关产品及系统的研发、生产和销售的企业，公司的核心业务聚焦在军工无线通信产业、情报与公共安全产业、无人化产业及智慧产业等四大领域。华讯方舟于1997年在深交所主板上市。,华讯方舟表示，2019年公司业绩下滑主要是在去产能、去杠杆的宏观经济环境下，公司对军民融合业务进行进一步规划，剥离部分业务；同时，受到客户需求及公司资金等内外生影响，公司业务订单下滑，交付及回款不及预期。,界面新闻注意到，华讯方舟在2019年对全资子公司南京华讯全额计提商誉减值9亿元，对应收账款及其他应收款计提减值准备3.2亿元，是公司巨亏的主要原因。,公司业绩巨亏具体可追溯到2018年。2019年1月31日，华讯方舟发布2018年业绩预告，预计2018年归母净利润为1200万元至1800万元，此后在4月25日发布的2018年业绩快报修正公告中，将2018年归母净利润向下修正为-4.88亿元。公司2018年年报显示，实际归母净利润为-4.88亿元，主要系报告期内对全资子公司南京华讯、国蓉科技计提商誉减值，以及计提坏账准备和存货跌价损失所致。,2020年1月16日，因2018年业绩预告修正公告不及时等原因，深交所对华讯方舟及华讯方舟董事长吴光胜、董事兼总经理张沈卫、副总经理兼财务总监张峥给予公开谴责的处分。,公司连续两年巨亏很大部分原因是由于前期收购的子公司商誉减值所致。事实上，在过去的十年间，公司的收购兼并举动很多，商誉随之不断累积增长。,其中南京华讯、国蓉科技是公司2015年通过资产置入及置出的方式取得。华讯科技彼时对拟置入资产国蓉科技、南京华讯作出业绩承诺，2015年-2017年两家公司合计实现的扣非后净利润分别不低于1.64亿元、1.89亿元和2.2亿元，而南京华讯2015年就未完成当年业绩承诺。,截至2020年一季度末，华讯方舟的资产负债率高达107.72%，货币资金仅有6691.2万元，公司的销售毛利率和销售净利率分别为-29.54%和-633.73%。控股股东华讯科技持有的29.46%公司股份已全部质押并被冻结，实控人吴光胜所持股份的逾70%已质押并被冻结。,肆意掏空，债台高筑,除了业绩低迷以外，公司今年以来也是“麻烦缠身”，子公司银行贷款频频出现逾期，公司自查发现违规担保事项，多次收到监管函，并面临重整的风险。,2月20日，华讯方舟收到监管函。监管函显示，公司2月19日公告披露，其全资子公司南京华讯部分银行贷款出现逾期，涉及本金1亿元，同时公司为上述贷款提供了担保，承担连带担保责任，逾期本金占公司最近一期经审计净资产比重的10.06%。公告披露的贷款逾期时间为2019年12月26日，而公司迟至2020年2月19日才披露上述公告。,3月18日，华讯方舟发布公告称公司涉及违规对外担保事项。具体为公司对控股股东华讯科技与天浩投资之间的买卖合同提供担保，后续华讯科技与天浩投资陷入合同纠纷，天浩投资于2019年12月3日提出仲裁申请，其中华讯方舟涉及的承担连带担保责任的金额达到4.98亿元，占公司最近一年经审计净资产的50.09%。经自查，上述担保未履行上市公司审批程序，公司认为以上违规担保属无效担保，上市公司无需承担连带责任。,3月28日，华讯方舟发布《关于债权人申请公司重整的提示性公告》，广州市沐阳产权经纪有限公司依据《中华人民共和国企业破产法》， 以公司不能清偿到期债务且明显丧失清偿能力可能为由，向法院提出对公司进行重整的申请。该申请能否被法院受理，公司是否进入重整程序尚具有不确定性。,5月19日，华讯方舟因未及时披露控股股东股权冻结事项被深交所通报批评。据了解，公司于2月3日收到控股股东华讯科技的通知，华讯科技所持华讯方舟全部股权于2019年12月24日起被司法冻结，涉及数量2.26亿股，占其所持公司股份的100%，占公司总股本的29.46%。,5月23日，因未及时披露前述子公司南京华讯贷款逾期事项以及控股股东华讯科技股权冻结事项，华讯方舟收到河北证监局出具的警示函。,高管离职，控股股东欲走人,在公司经营陷入泥潭之际，华讯方舟的高管相继离职，控股股东亦欲转让股权离场，为公司的未来更添几分不确定性。,1月21日，公司董秘李湘平提出辞职；3月16日，公司董事徐健、监事李晓丛离职；对2019年年报“无法保真”的独董曹健、谢维信于4月7日提出辞职，同时辞职的还有独董张玉川。此后，公司证券事务代表刘天睿，公司董事、总经理张沈卫也相继离职。,对于高管的相继离职，深交所也发函询问。华讯方舟表示，三位独董离职的主要原因是认为近年来和公司管理层的沟通变得不够顺畅，了解公司实际情况比较困难，管理层一再违规，人员更替过于频繁，且自身年龄较大，没有足够充沛的精力面对公司日益复杂的局面，因此辞职。,2019年7月，华讯方舟控股股东华讯科技及公司实控人吴光胜与深圳远致投资签署了《股份转让框架协议》，华讯科技拟将其持有的公司1.45亿股无限售条件流通股（约占总股本的18.94%）转让给远致投资，转让价为5.94元/股，总价为8.62亿元。股份转让完成后，远致投资或其指定的投资主体将成为上市公司第一大股东，华讯科技为上市公司的第三大股东，上市公司将无控股股东及实际控制人。,公布拟变更控制权的消息后，华讯方舟股票短期内收获四个涨停板。此后，公司深陷子公司银行贷款逾期、涉及诉讼，银行账户被冻结，控股股东所持公司股份被强制平仓和司法冻结的困境之中。,而华讯科技与远致投资的股份转让事项没有了下文，直到2020年1月21日，华讯方舟公告称，华讯科技及公司实际控制人吴光胜与仁东集团签署了《股权投资合作框架协议》，仁东集团拟通过增资华讯科技、受让华讯科技股权等方式累计取得华讯科技不低于51%的股权，达到控股地位。,同时，吴光胜将其所持华讯科技33.8599%股权（对应15992万元出资额），并协调华讯科技其他股东将其持有的华讯科技不低于17.1401%股权，合计不低于51%股权，以委托管理方式由仁东集团依其经营管理方式统一进行管理，委托期限自正式股权托管协议生效之日起至仁东集团及/或仁东集团同意或指定的第三方取得华讯集团的股权达到控股的比例时止。若后续能签署正式的股权托管协议，未来华讯方舟的实控人将由吴光胜变更为霍东。,据了解，霍东担任仁东控股董事长的一年多时间里，仁东控股甩掉了多年未能豁免的非标年报，从而脱胎换骨重获新生。,华讯方舟此番的股权托管目的很明确，仁东集团在实现对华讯集团的股权托管、取得实际控制权后，将运用自身金融产业整合的资源优势，为华讯集团带来新的经营性流动资金的支持，可优化、重组华讯集团现有债务结构，提升华讯集团的偿债能力。,不过，自4月2日披露控股股东与仁东集团的股权合作进展后，华讯方舟至今尚未公布该事项的进展情况。,4月2日，华讯方舟表示，“因疫情影响，原定于3月31日前签署正式托管协议的计划无法按期实施，双方目前正就协议的具体细节进行商讨。”,责任编辑：陈志杰",https://finance.sina.com.cn/roll/2020-06-15/doc-iirczymk7164212.shtml,sinaStock
16,2020-06-15 20:09:00,科创板分拆上市又迎一单：中国铁建子公司IPO获受理,"原标题：科创板分拆上市又迎一单，中国铁建子公司IPO获受理,科创板分拆上市又迎来一单。,6月15日晚间，中国铁建（601186.SH）旗下子公司铁建重工科创板IPO申请获受理。同日晚间，中国铁建发布公告称，铁建重工是于6月12日向上海证券交易所（下称“上交所”）提交了科创板首发申请。,中国铁建是A股首家披露分拆子公司赴科创板上市预案的公司。2019年12月13日，证监会正式出台《上市公司分拆所属子公司境内上市试点若干规定》。6天后的2019年12月19日，中国铁建便公告称，拟将旗下子公司铁建重工分拆至科创板上市。之后于2020年4月2日，中国铁建发布分拆子公司到科创板上市的预案修订稿。,中国铁建主营业务为工程承包、勘察设计咨询、工业制造、物流与物资贸易等。在预案修订稿中，中国铁建称，铁建重工与中国铁建其他业务板块之间保持高度的业务独立性，分拆上市不会对主营业务构成实质性影响。,根据铁建重工招股说明书，该公司主要从事掘进机装备、轨道交通设备和特种专业装备的设计、研发、制造、销 售、租赁和服务。,2017年度~2019年度，铁建重工分别实现营收66.51亿元、79.31亿元、72.82亿元，归母净利润11.37亿元、16.07亿元、15.30亿元。以此来看，该公司2019年营收和净利润同比2018年均有所下滑。,对于铁建重工上市给中国铁建带来的财务影响，中国铁建曾在预案修订稿中称，铁建重工发行完成后，总资产、净资产和总股本规模扩大，由于其上市募集资金投资项目建设需要一定的周期，其净利润水平受国家宏观经济形势、募投项目建设进度等多种因素影响，短期内可能难以同步增长，随着上市公司持有铁建重工的权益被摊薄，预计铁建重工归母净利润短期内可能较分拆上市前有所减少，而上市公司合并报表内的总资产和净资产较分拆前将有所增加。,铁建重工此次赴科创板上市，选择的是第四套上市标准，即“预计市值不低于人民币30亿元，且最近一年营业收入不低于人民币3亿元。”,铁建重工上市拟募集资金77.87亿元，扣除发行费用后投资于三大块：研发与应用项目、生产基地建设项目、补充流动资金。,同时，铁建重工也提示风险称，存在客户集中度较高的风险。若重要客户出现财务状况下滑的情形，将会在较大程度上影响该公司的盈利水平。,受我国交通基建行业投资主体特点影响。铁建重工下游客户比较集中，主要为国铁集团及其控制的企业，以中国中铁、铁建股份为代表的大型交通基建施工类企业，以及专业工程设备租赁商等。2017年~2019年，铁建重工对前五大客户（受同一实际控制人控制的客户合并计算）的销售收入占当期营业收入的比例分别为73.09%、76.60%和60.12%。,截至2017年末、2018年末、2019年末，铁建重工应收账款账面价值分别为41.10亿元、41.39亿元和45.67亿元，占流动资产的比例分别为36.84%、36.21%和47.16%。,“公司应收账款占流动资产比例较高，随着公司经营规模的扩大，应收账款金额存在逐步增加的可能性，如公司采取的收款措施不力或客户信用发生变化，公司应收账款发生逾期乃至坏账的风险将加大。”铁建重工称。,对于疫情带来的影响，铁建重工在招股说明书中称，鉴于本次疫情对公司的复工时间、 物流周期、上下游企业复工时间等造成了影响，尤其是公司所面向的基建工程领域、轨道交通施工领域受疫情影响较为明显，出现施工项目停工，拟建设项目推迟审批开工等情况，公司的采购、生产和销售等经营活动在短期内受到了一定程度的影响。,“目前，新冠肺炎疫情对公司所涉产业链的整体影响尚难以准确估计，如果疫情在全球范围内继续蔓延且持续较长时间，或者国内疫情出现反弹、防控措施升级，可能对公司2020年全年经营情况和盈利水平产生不利影响。”铁建重工提示风险称。,责任编辑：陈志杰",https://finance.sina.com.cn/roll/2020-06-15/doc-iircuyvi8634339.shtml,sinaStock
17,2020-06-15 20:02:00,国有大行开启高管“轮岗”大幕：工行最频繁 建行辞任多,"原标题：国有大行开启高管“轮岗”大幕：工行最频繁，建行辞任多,国有大行再添一名副行长。工商银行近日公告称，董事会近期将工商银行原财务会计部总经理张文武提拔为副行长，正等待监管审批。,今年以来，六大行的高层人事变动中，工商银行动作最大。除了张文武职位变动之外，4月初，工行还迎来了副行长王景武，熊燕和宋建华也在今年获批成为工行高级业务总监，王百荣则从首席风险官转任高级业务总监。,而建设银行今年高管辞任较多，今年4月，副行长黄毅、首席财务官许一鸣、监事方秋月先后离任。,工商银行人事变动最大,日前，工商银行发布董事会决议公告称，决定聘任张文武为工商银行副行长。张文武的任职经董事会审议批准后，还需银保监会核准。,公开资料显示，张文武1973年3月出生，1995年7月加入工商银行，2007年1月任财务会计部副总经理，2009年2月起，先后担任辽宁省分行副行长、工商银行保险项目工作组成员，2012年7月任工银安盛人寿保险有限公司执行董事、首席财务官，2015年11月起，先后担任工商银行监事会办公室主任、工商银行财务会计部总经理。,在六大行中，今年上半年，工商银行人事变动最为频繁。4月28日，工商银行决定聘任王百荣为高级业务总监，不再担任首席风险官职务。此前，王百荣于1991年9月加入工商银行，2006年6月任浙江省分行副行长兼分行营业部总经理，2010年5月起，前后担任重庆市分行副行长、重庆市分行行长，2016年7月任工商银行首席风险官。另外，担任工商银行高级业务总监的还有熊燕和宋建华，两人在今年4月任职生效。,今年，工商银行还迎来了一位副行长，4月16日，银保监会核准王景武担任工商银行副行长的任职资格。,王景武出身央行，拥有多年的金融行业工作经验。早在1985年8月在人民银行参加工作，2002年1月任石家庄中心支行监管专员（副局级），2003年9月任石家庄中心支行行长兼国家外汇管理局河北省分局局长，2009年12月任呼和浩特中心支行行长兼国家外汇管理局内蒙古自治区分局局长，2012年6月任广州分行行长兼国家外汇管理局广东省分局局长，2018年12月出任央行金融稳定局局长。,同期，今年2月，工商银行原副行长胡浩因工作变动，辞去执行董事，董事会社会责任与消费者权益保护委员会、风险管理委员会、关联交易控制委员会和美国区域机构风险委员会委员，副行长职务。,工商银行也有多位非执行董事发生变动，例如，独立非执行董事希拉·贝尔因任期届满，自2020年3月31日起不再担任独立非执行董事职务；非执行董事叶东海因工作变动，于2020年3月4日提交辞呈。,建设银行高管辞职多,在其他五大行中，建设银行最近两年高管辞职相对频繁。今年4月13日，因年龄原因，方秋月辞去建设银行股东代表监事、监事会履职尽职监督委员会委员、监事会财务与内部控制监督委员会委员等职务。,同样因年龄原因，许一鸣也提出辞去建设银行首席财务官职务。4月3日，因退休，黄毅向建设银行董事会提出辞呈，辞去副行长职务。,其实，2019年，建设银行高管变动也相对较多。去年3月，王祖继辞任行长、副董事长、执行董事职务；去年11月，廖林辞去副行长职务；去年5月底，原董事会秘书黄志凌辞职。,另外一家国有大行交通银行人事变动也不小。今年5月29日，交通银行发布公告称，选举刘珺为交通银行副董事长。不过，刘珺的副董事长职务，须待股东大会选举其为执行董事且银保监会核准其执行董事、副董事长任职资格后生效。会议并同意聘任刘珺为交通银行行长。若刘珺的行长任职资格获核准，任德奇不再代行行长职责。,早在4月27日，交通银行侯维栋因年龄原因，向交通银行董事会辞去执行董事、副行长、董事会战略委员会（普惠金融发展委员会）委员职务。另外，1月16日，银保监会核准任德奇任交通银行董事长的任职资格，自2020年1月16日起，担任交通银行董事长，不再担任副董事长。,今年以来，中国银行（维权）的高层人事变动亦有不少，3月5日，因工作调动，廖强已向中国银行董事会辞去非执行董事、董事会战略发展委员会委员、企业文化与消费者权益保护委员会委员及风险政策委员会委员职务。2月7日，吴富林因工作调动，辞去执行董事、董事会关联交易控制委员会委员及副行长职务。,有出也有进。1月21日，银保监会核准王江为中国银行副董事长、执行董事任职资格。王江出生于1963年，2019年12月起任中国银行行长。此前，2017年7月至2019年11月担任江苏省副省长；2015年8月至2017年7月担任交通银行副行长。王江也曾在建设银行工作多年，先后担任建设银行山东省分行副行长、湖北省分行行长、上海市分行行长等职务。,六家国有大行中，农业银行和邮储银行今年高层较为稳定。3月24日，周万阜请求辞去农业银行董事会秘书。1月20日，张青松获批就任农业银行副董事长；2月19日，梁世栋获批任职邮储银行首席风险官。更早时间，2020年2月14日，邮储银行迎来新行长郭新双，结束了邮储银行一年来行长职位的空缺。,责任编辑：陈志杰",https://finance.sina.com.cn/roll/2020-06-15/doc-iirczymk7163178.shtml,sinaStock
18,2020-06-15 20:00:00,上海天洋关于财务负责人辞职及聘任财务负责人的公告,"证券代码：603330       证券简称：上海天洋            公告编号：2020-046,上海天洋热熔粘接材料股份有限公司,关于财务负责人辞职及聘任财务负责人的公告,本公司董事会及全体董事保证本公告内容不存在任何虚假记载、误导性陈述或者重大遗漏，并对其内容的真实性、准确性和完整性承担个别及连带责任。,上海天洋热熔粘接材料股份有限公司（以下简称“公司”） 董事会于近日收到张旭先生的书面辞职报告，公司财务负责人张旭先生因个人原因申请辞去公司财务负责人职务，辞去财务负责人职务后张旭先生将不再担任公司任何职务。,根据《公司法》和本公司《公司章程》等法律法规的有关规定，张旭先生的辞职报告自送达董事会之日起生效。公司董事会对张旭先生在公司任职财务负责人职务期间对公司所做出的贡献表示衷心的感谢。,鉴于上述情况，根据公司总经理李哲龙先生提名，由董事会提名委员会审议通过后，公司于2020年6月15日召开了第三届董事会第五次会议，审议通过了《关于聘任财务负责人的议案》，同意聘任秦嘉伟先生为公司财务负责人，任期自本次董事会审议通过之日起至第三届董事会任期届满之日止。,截至本公告日，秦嘉伟先生未持有本公司股份，与实际控制人、持有公司5%以上股份的股东、公司现任董事及高级管理人员不存在关联关系，未受过中国证监会及其他有关部门的处罚和证券交易所惩戒，不存在《公司法》等法律、法规、规范性文件以及《公司章程》规定的不得担任公司高级管理人员的情形。,特此公告。,上海天洋热熔粘接材料股份有限公司,董事会,2020 年 6 月 15 日附：秦嘉伟先生简历,秦嘉伟，男，1981 年 4 月出生，中国国籍，研究生学历，上海交通大学信息管理硕士。曾任安永华明会计师事务所财务审计师、德勤咨询（上海）有限公司高级咨询顾问、东方花旗证券有限公司业务总监、蕴致（上海）时装有限公司首席财务官、呀谧网络科技（上海）有限公司首席财务官。2020 年 6 月 15 日起，担任上海天洋热熔粘接材料股份有限公司财务负责人。,责任编辑：小浪快报",https://finance.sina.com.cn/stock/ggzz/2020-06-15/doc-iircuyvi8632430.shtml,sinaStock
19,2020-06-15 19:58:00,深交所发函乐视网：未配合履行信披义务 请吸取教训及时整改,"原标题：深交所发函乐视网：未配合履行信披义务，请吸取教训及时整改,6月15日，深圳证券交易所发布对乐视网信息技术（北京）股份有限公司（乐视退（维权），300104）的监管函。,深交所表示，2020 年 6 月 3 日晚间，融创房地产集团有限公司（以下简称“融创集团”）、致新云网企业管理（天津）有限公司（以下简称“致新云网”）分别披露《简式权益变动报告书》。天津盈瑞汇鑫企业管理有限公司（以下简称“盈瑞汇鑫”，由融创集团通过合约控制）与致新云网于 2020 年 5 月 22 日签署《股权转让协议书》，致新云网受让盈瑞汇鑫持有的天津嘉睿汇鑫企业管理有限公司（以下简称“嘉睿汇鑫”）100%的股权，间接受让嘉睿汇鑫持有的乐视退341422214 股股份，占公司总股本的 8.56%。,根据乐视网2020 年 6 月 5 日披露的《关于对深圳证券交易所关注函回复的公告》显示，信息披露义务人已在规定的时间将权益变动相关文件递交公司，但公司未能及时配合履行信息披露义务。,“你公司的上述行为违反了本所《创业板股票上市规则（2018 年 11 月修订）》第 1.4 条、第 11.8.1 条的规定。请公司董事会充分重视上述问题，吸取教训，及时整改，杜绝上述问题的再次发生。”深交所表示。,乐视退于 2020 年 6 月 4 日收到深圳证券交易所《关于对乐视网信息技术（北京）股份有限公司的关注函》。在关注函中，深交所提出了“转让双方于 5 月 22 日签署协议但直至 6 月 3 日才披露权益变动报告书的原因，是否符合《上市公司收购管理办法》等相关规则的规定。”的问题。,对此，乐视退回复称：“根据公司经营现状与业务需求，为维持持续经营能力，公司 2019 年进行了大幅人员优化，目前公司总经理、董事会秘书、财务总监，均由董事长刘延峰先生一人兼任。自 2020 年 5 月 13 日，公司发布终止上市公告以来，投资者接待与投资者电话接听工作量陡然上升，为维持社会稳定，公司尽力做好投资者接待工作，尽最大努力安抚股东情绪。,在此期间，虽然信息披露义务人已按照相关规则的规定，在规定时间内把权益变动相关文件递交至公司，但基于工作人员的工作情况，当时认为此转让行为是乐视网持股公司的股东转让，无需进行披露，也未就该事项通报董事会，未能及时做好信息披露工作。该事件发生在公司停牌期间，发现问题后，公司尽最大努力进行补救，立刻安排权益变动书披露工作，在股票复牌之前，完成了信息披露。公司对未能及时披露相关公告感到十分抱歉！”",https://finance.sina.com.cn/stock/relnews/cn/2020-06-15/doc-iirczymk7162519.shtml,sinaStock
