id,datetime,title,content,link,source
35,2020-06-15 19:00:00,有方科技关于董事辞职的公告,"证券代码：688159         证券简称：有方科技         公告编号：2020-021,深圳市有方科技股份有限公司,关于董事辞职的公告,本公司董事会及全体董事保证本公告内容不存在任何虚假记载、误导性陈述或者重大遗漏，并对其内容的真实性、准确性和完整性承担个别及连带责任。,深圳市有方科技股份有限公司（以下简称“公司”）董事会近日收到公司外部董事刘培龙先生提交的书面辞职报告。刘培龙先生因北京汽车集团产业投资有限公司内部工作调整，申请辞去公司董事职务。辞职后，刘培龙先生不再担任公司的任何职务。,截至本公告日，刘培龙先生未持有公司股票。,根据《公司法》、《公司章程》等相关规定，刘培龙先生的辞职未导致公司董事会成员人数低于法定人数，不影响公司董事会的正常运行，亦不会对公司日常运营产生不利影响，刘培龙先生递交的辞职报告自送达董事会之日起生效。公司将按照相关法律法规及《公司章程》的有关规定，尽快完成董事的补选工作。,刘培龙先生在担任公司董事期间恪尽职守、勤勉尽责，公司及董事会对刘培龙先生任职期间为公司做出的贡献表示衷心感谢！,特此公告。,深圳市有方科技股份有限公司董事会,2020 年 06 月 16 日,责任编辑：小浪快报",https://finance.sina.com.cn/stock/ggzz/2020-06-15/doc-iircuyvi8625182.shtml,sinaStock
36,2020-06-15 19:00:00,6月16日涨停板早知道：七大利好有望发酵,"炒股就看金麒麟分析师研报，权威，专业，及时，全面，助您挖掘潜力主题机会！,新浪财经讯 6月15日消息，有七大利好可能影响明日股市，具体为：,中新药业：天津市医药集团开展混改  拟通过股权转让引入投资者,中新药业公告，公司收到控股股东天津市医药集团通知，其控股股东渤海国资拟于6月16日将其持有的天津市医药集团股权在天津产权交易中心进行产权转让项目信息预披露，转让比例不低于65%。天津市医药集团开展国有企业混合所有制改革拟通过股权转让形式引入投资者，导致其股权结构发生重大变化，可能将会导致公司的实际控制人发生变更。,安图生物：拟定增募资不超32.8亿元,安图生物6月15日晚间公告，拟定增募资不超32.8亿元，将用于安图生物体外诊断产业园（三期）项目、安图生物诊断仪器产业园之营销网络建设项目、补充流动资金。,迪瑞医疗：核酸提取试剂盒取得《第一类医疗器械备案凭证》,迪瑞医疗公告，公司核酸提取试剂（磁珠法）于近日取得由长春市市场监督管理局颁发的1项《第一类医疗器械备案凭证》。核酸提取试剂（磁珠法）用于核酸的提取、富集、纯化等步骤。其处理后的产物用于临床体外检测使用。,西藏药业：与斯微生物合作 获得其新冠疫苗等产品独家授权,西藏药业6月15日晚间公告，经前期调研，公司与斯微生物缔结面向全球的独家战略合作关系，公司通过向斯微生物支付新冠疫苗产品、结核疫苗及流感疫苗产品合作对价，获得上述产品全球独家开发、注册、生产、使用及商业化权利。公司根据新冠疫苗、结核疫苗及流感疫苗的研发进度，分阶段向斯微生物投资3.51亿元，获得上述疫苗的全球独家授权。,沃森生物：子公司二价HPV疫苗申请新药生产的药品注册申请获得受理,沃森生物公告，公司控股子公司上海泽润拥有自主知识产权研发的“重组人乳头瘤病毒双价（16/18 型）疫苗（酵母），将由上海泽润全资子公司玉溪泽润进行产业化生产，根据《疫苗管理法》等相关法律法规的规定，玉溪泽润向国家药品监督管理局提交了本疫苗的新药生产申请并于2020年6月15日收到国家药品监督管理局出具的《受理通知书》，受理号：CXSS2000024国和CXSS2000025国（西林瓶和预灌封两个剂型）。,上海天洋：拟定增募资不超6.8亿元,上海天洋6月15日晚披露非公开发行股票预案，募集资金总额不超6.8亿元，将全部用于高档新型环保墙布及产业用功能性面料生产项目、热熔粘接材料项目、补充流动资金。公司同时披露，拟收购烟台泰盛精化科技有限公司65%股权，泰盛精化是一家以工业用高端胶粘剂研发、生产、销售为一体的高新技术企业，整体估值约为8700万元左右。,太极实业：子公司签订10.89亿元重大工程项目合同,太极实业公告，公司控股子公司十一科技与江苏仁奇科技有限公司签订了《EPC总承包工程合同》。总承包工程合同金额10.886亿元，拟用2年在泗阳经济开发区建成一个涵盖芯片制造、封测、研发的产业化基地，形成年产6英寸0.25um芯片线60万片，年封测10亿颗的生产能力。,责任编辑：逯文云",https://finance.sina.com.cn/stock/e/2020-06-15/doc-iirczymk7155337.shtml,sinaStock
37,2020-06-15 18:51:00,万泰生物：公司新冠检测试剂销量占比不大,"新浪财经讯 6月15日消息，万泰生物晚间公告，公司股票价格6月11日、6月12日和6月15日连续3个交易日累计涨幅达到24.99%，自上市至今，股票价格累积涨幅已达1831.89%。公司特别提醒投资者，注意二级市场交易风险。公司新冠检测试剂销售量占公司总体收入比重不大，对公司财务状况不会产生重大影响。双价宫颈癌疫苗（HPV2价）上市时间不长，疫苗销售对于公司利润的影响存在不确定性。,责任编辑：陈志杰",https://finance.sina.com.cn/stock/s/2020-06-15/doc-iircuyvi8624185.shtml,sinaStock
38,2020-06-15 18:48:00,交易涉及部分不确定因素 南京化纤终止收购越科新材,"南京化纤（600889）6月15日晚间公告，此前公司拟以发行股份及支付现金的方式收购越科新材控制权并募集配套资金。但由于本次交易涉及部分不确定因素，较难在较短时间内明确并形成具体可行的方案。公司决定终止筹划本次发行股份及支付现金购买资产事项。公司6月16日复牌。,在谈及终止本次交易对公司的影响时，南京化纤方面表示，本次交易各方除《投资意向协议》外未就交易具体方案达成正式协议。终止筹划本次交易是公司审慎研究后做出的决定，不会对公司的生产经营造成重大不利影响。,据悉，南京化纤的主要业务是从事粘胶短纤维、景观水的生产与经营。截止2019年末，公司具有粘胶短纤8万吨/年生产能力。公司水厂位于南京市栖霞区燕子矶，拥有15万吨/日景观水供水能力。所生产的景观水用于玄武湖、金川河水系、北十里长沟等内河引流补水。,最近几年，受到行业整体景气度不佳的影响，南京化纤也持续面临着经营压力。南京化纤2018年年报显示，受到粘胶纤维产品售价低位盘整，同时进口木浆粕、燃料煤及烧碱、硫酸、二硫化碳等化工料的采购成本居高不下，全行业亏损面很大，形势相当严峻，南京化纤也面临着巨大的经营压力。,2019年，行业整体形式愈加严峻。南京化纤在2019年年报中介绍说，2019年国内经济发展面临的环境比2018年更为复杂严峻，爆发贸易战对纺织行业造成严重冲击，人民币汇率波动加大，纺织品出口不畅，粘胶短纤下道企业开工率大幅下降，纺织原料价格跌幅均超过10%，短纤每吨售价更是由2018年末1.32万元下跌至9200元，跌幅近30%，创下20年来的低位，短纤产品销售困难，生产厂家库存已达极限，纷纷减产、停产降低损失。,据悉，为应对以上情况，南京化纤全资子公司江苏金羚纤维素纤维有限公司自2019年5月起停产三个月检修去化库存，造成停产损失5200万元。,在整体行业景气度下行的背景下，南京化纤最近几年的经营业绩难言乐观：公司2016年、2017年、2018年和2019年分别实现净利润9083万元、-3.03亿元、621万元和-1.31亿元。,面对行业的持续低迷，南京化纤在2019年年报当中表示，公司将密切关注粘胶纤维行业发展动态，发挥竞争优势，扩大粘胶短纤产能，加大新品研发力度，灵活调整竞争策略，增产高附加值产品以全面提升企业竞争力。将以粘胶纤维主业为基础，抓紧实施新项目建设，促进纤维素纤维主业提档升级，实现战略转型；积极探索并购业务，改变公司产业结构单一现状，尽快实现“双轮驱动”发展。,正是在这样的背景下，南京化纤才会在日前筹划收购越科新材。,天眼查显示，越科新材是结构复合材料技术提供商和产品制造商，专注于高性能要求和大型的结构性复合材料件的整体解决方案提供，模具设计制造，原材料供应。,从越科新材的经营业务不难看出，该公司的业务与南京化纤现有业务的关联度并不高。此次并购更多还是为了贯彻执行“积极探索并购业务，改变公司产业结构单一现状，尽快实现‘双轮驱动’发展”的战略。,如今，虽然南京化纤宣布终止收购越科新材，但是考虑到南京化纤目前所处行业的发展现状以及公司此前提出的发展战略，有理由相信，南京化纤在后市仍将会继续考虑对外并购，以实现“双轮驱动”发展战略。,责任编辑：陈志杰",https://finance.sina.com.cn/stock/s/2020-06-15/doc-iircuyvi8624212.shtml,sinaStock
39,2020-06-15 18:43:00,天津市医药集团开展混改 两上市公司实控人或变更,"天津市国企混改工作有序推进，天津市医药集团有限公司（以下简称“医药集团”）拟通过股权转让形式引入投资者。一旦有受让方成功摘牌，将导致医药集团股权结构发生重大变化，中新药业（600329）和天药股份（600488）这两家A股上市公司的实际控制人或将因此发生变更。,中新药业6月15日晚公告，收到控股股东医药集团通知，其控股股东渤海国资拟于6月16日将其持有的医药集团股权在天津产权交易中心进行产权转让项目信息预披露，转让比例不低于65%。,天眼查显示，医药集团是是天津市政府授权的从事资本经营和产业运营的大型国有独资企业集团，中国500强企业之一。经过近40年的发展，现已发展成以绿色中药、化学原料药、化学制剂与生物药、特色医疗器械、现代商业物流五大板块为主体，科研、生产、商业销售一体化运作。渤海国资持有医药集团100%股权。,天药股份6月15日晚同步公告称，收到间接控股股东医药集团通知，渤海国资拟于2020年6月16日将其持有的医药集团股权在天津产权交易中心进行产权转让项目信息预披露，转让比例不低于65%。,据了解，医药集团持有天津金耀集团有限公司100%股权，天津金耀集团有限公司持有天津药业集团有限公司74%股权，天津药业集团有限公司持有天药股份50.79%股权。,据悉，为了加快国企混改进程，天津市在此前出台了“1+30”配套文件体系，依法依规推进国企改革。通过“一企一策”制定混改方案，合理设置股权比例，打破国有股“一股独大”，加快国资管理由“管资产”向“管资本”转变。,2018年11月，在天津市国有企业混改项目招商推介会上进行集中推介的24个混改招商项目当中，天津市医药集团有限公司榜上有名。根据彼时媒体的介绍，医药集团拟采取增资扩股与产权转让相结合的方式，引入投资者改制为混合所有制企业。投资者须承诺，混改后医药集团注册地仍在天津。,中新药业和天药股份均在6月15日晚最新发布的公告当中表示，医药集团开展国有企业混合所有制改革拟通过股权转让形式引入投资者，导致其股权结构发生重大变化，可能将会导致公司的实际控制人发生变更。,值得一提的是，除了中新药业和天药股份之外，力生制药也在6月15日晚披露了关于医药集团混改事宜的相关公告。,据悉，在此之前的2019年10月31日，力生制药接到医药集团通知，为落实天津市人民政府有关国企混改的总体部署，医药集团将其持有的津联集团有限公司（以下简称“津联集团”）100%股权无偿划转至渤海国资；同时，将津联集团通过其全资子公司金鼎控股有限公司持有的隆腾有限公司33%股权无偿划转至医药集团境外全资子公司天津医药集团国际控股有限公司（上述两项划转统称“无偿划转”）。无偿划转完成后，医药集团不再是力生制药间接控股股东，但公司实际控制人不变，仍为天津市国资委。,2020年1月23日，力生制药收到医药集团发来的通知，中国证监会已下发《关于核准豁免天津渤海国有资产经营管理有限公司要约收购天津力生制药股份有限公司股份义务的批复》。至此，无偿划转有关协议下的生效条件均已获满足，无偿划转协议已生效。无偿划转的订约方已依照被划转企业所在地规定，于2020年4月2日签署了无偿划转相关的股份转让文件。目前，隆腾有限公司的股东名册已完成变更，但津联集团的股东名册尚未完成变更。,力生制药称，基于无偿划转事项的相关安排，本次医药集团混改不会导致公司的实际控制人发生变化，医药集团混改资产范围需以其混改正式披露信息为准。,责任编辑：陈志杰",https://finance.sina.com.cn/roll/2020-06-15/doc-iircuyvi8623250.shtml,sinaStock
