id,datetime,title,content,link,source
0,2020-06-15 21:04:00,晚间公告热点追踪：杭锅股份所购四川信托产品逾期兑付,"炒股就看金麒麟分析师研报，权威，专业，及时，全面，助您挖掘潜力主题机会！,四川信托炸群 杭锅股份购买的信托产品发生逾期兑付,6月15日晚间，杭锅股份发布公告称，2019年12月4日，公司购买了由四川信托管理发行的“天府聚鑫3号集合资金信托计划”之信托产品，金额为5000万元，期限为6个月。2020年6月11日，四川信托兑付了公司购买的信托产品20%即1000万元的本息1038万元，剩余4000万元本息未能如期兑付。预计信托产品账面资产将发生一定幅度的减值，可能影响公司2020年财务业绩。,2019年4月19日，杭锅股份2018年度股东大会审议同意，上市公司使用额度不超过20亿元的闲置自有资金投资理财产品，董事会授权上市公司管理层和控股子公司管理层具体实施。,随后，2019年12月4日，杭锅股份购买了由四川信托管理发行的“天府聚鑫3号集合资金信托计划”之信托产品，金额为5000万元，期限为6个月，预期年化收益率为7.6%，预期收益金额为190万元，到期日为2020年6月4日。,2020年6月11日，四川信托兑付了杭锅股份购买的“天府聚鑫3号集合资金信托计划”之信托产品20%即1000万元的本息1038.1万元；剩余4000万元本息未能如期兑付。杭锅股份表示，结合该信托项目的情况，对信托产品本金的未来现金流量进行测算，预计信托产品账面资产将发生一定幅度的减值，可能影响上市公司2020年财务业绩。,除此之外，杭锅股份还斥资16.55亿元购买了35款信托、证券、银行等理财产品，最近12个月内单日最高投入金额为18.05亿元，占最近一年净资产比例为55.51%。,今年5月份以来，围绕着四川信托的各种传闻便接踵而至。四川信托曾于5月11日发布声明，否认“四川信托即将被接管，资金池业务全部停止”等传闻。,值得注意的是，四川信托净利润呈现逐年下降趋势。2017年~2019年期间，四川信托分别完成营业收入31.35亿元、27.88亿元和31.71亿元，实现净利润则为9.29亿元、7.33亿元和6.58亿元。,截至到2020年5月31日，杭锅股份资产总额96.65亿元，负债总额63.29亿元，归属于上市公司股东的净资产31.21亿元，货币资金为13.66亿元；此次逾期兑付的投资资金占货币资金的比例为3.66%。,四川信托表示，开业以来，该公司始终坚持以市场为导向、以风险控制为核心、以稳健发展为基础、以创新研发为动力，以西部金融中心成都为大本营，服务遍及西部、华北、华东、华南等片区，积极开辟周边省份、城市的信托业务，经营触角延伸至全国各地，先后荣获“年度最佳信托公司”、“中国最具成长性信托公司”等殊荣。,天眼查显示，从股东层面来看，四川信托现有10位股东，四川宏达（集团）有限公司持股比例达到32.04%，高居第一大股东之位，刘沧龙为最终实控人；持股比例超过5%的重要股东包括，中海信托股份有限公司（30.25%）、宏达股份（22.16%）和四川濠吉食品集团有限公司（5.04%）。,四川信托还拥有汇源集团有限公司、中国铁路成都局集团有限公司、四川省投资集团有限公司、四川成渝、中铁八局集团有限公司、中国烟草总公司四川省公司等背景实力雄厚的股东，持股比例分别为3.84%、3.57%、1.39%、1.17%0.42%和0.11%。,值得一提的是，2017年9月，泰合集团曾欲斥资43亿元通过收购宏达实业的股权，从而入主宏达股份（600331），由此拿下四川信托和宏信证券控股权，掌握信托和证券牌照。但此后，这笔股权交易并未如约推进，刘沧龙仍然牢牢地掌握控股权。,【热点】,西藏药业：与斯微生物合作 获得其新冠疫苗等产品独家授权,西藏药业（600211）6月15日晚间公告，经前期调研，公司与斯微生物缔结面向全球的独家战略合作关系，公司通过向斯微生物支付新冠疫苗产品、结核疫苗及流感疫苗产品合作对价，获得上述产品全球独家开发、注册、生产、使用及商业化权利。公司根据新冠疫苗、结核疫苗及流感疫苗的研发进度，分阶段向斯微生物投资3.51亿元，获得上述疫苗的全球独家授权。,富春股份澄清：公司暂未与字节跳动开展具体业务合作,富春股份（300299）6月15日晚发布股价异动公告称，近期市场传闻公司与字节跳动开展合作，公司澄清如下：截至目前，公司暂未与字节跳动开展具体业务合作。如有相关合作信息，公司将履行信息披露义务。,两连板皖新传媒：公司投资巴九灵金额较少 对公司影响较小,皖新传媒（601801）6月15日晚间披露股价异动公告称，近日有媒体报道称公司投资了杭州巴九灵文化创意股份有限公司。目前，公司累计投资巴九灵180万元，持有巴九灵股权比例为15.53%。公司投资金额较少，对公司影响较小，敬请广大投资者注意投资风险。,创源文化：2019年子公司猜猜盒产品销售仅为30万元左右,创源文化（300703）6月15日晚发布股价异动公告称，目前主要销售方向为中高端文教用品，又以海外市场为主，2019年公司出口销售额占主营业务收入的比例为96%，预计地摊经济的推广不会对公司经营产生重大影响。子公司杭州少女心选电子商务有限公司旗（金麒麟分析师）下天猫店铺正在销售猜猜盒产品（类似盲盒产品），但该产品的销售基数较小，2019年子公司猜猜盒产品销售仅为30万元左右，因此，对公司经营不产生重大影响。,【并购重组】,南京化纤：终止收购上海越科控制权 明日复牌,南京化纤（600889）6月15日晚间公告，此前公司拟以发行股份及支付现金的方式收购上海越科控制权并募集配套资金。但由于本次交易涉及部分不确定因素，较难在较短时间内明确并形成具体可行的方案。公司决定终止筹划本次发行股份及支付现金购买资产事项。公司6月16日复牌。,ST亚星：拟终止重大资产重组,ST亚星（600319）6月15日晚间公告，公司拟终止筹划重大资产置换及发行股份购买山东宏济堂制药集团、山东科源制药100%股份并募集配资事项。公司目前仍需与各交易相关方继续落实并协商相关事宜，待与各交易方履行完备终止协议的签署和审批、决策程序后，公司将及时披露终止重组的相关公告。,盛运环保（维权）：终止筹划重大资产重组,盛运环保（300090）6月15日晚间公告，由于公司股票已连续20个交易日收盘价格均低于股票面值（即1元），根据规定公司股票可能被终止上市。公司决定终止筹划彭水县茂博矿业集团有限公司及其关联方重庆茂田矿业有限公司以其资产注入协助公司解决资金占用问题的重大事项。,*ST夏利：拟调整重大资产重组方案 股票停牌,*ST夏利（000927）6月15日晚公告，公司拟对重大资产重组方案作出调整，涉及新增发行股份购买资产的交易对方，预计将构成对方案的重大调整。股票自6月16日开市起停牌，预计停牌不超过5个交易日。,博思软件：拟2.43亿元收购博思致新剩余49%股权,博思软件（300525）6月15日晚公告，公司拟通过发行股份的方式购买博思致新49%股权，交易作价为2.43亿元。同时，公司拟向公司控股股东、实际控制人陈航定向发行股份募集配套资金1.6亿元，用于支付本次交易费用、政务行业通用服务平台项目及上市公司补充流动资金。交易完成后，公司持有博思致新100%股权。交易完成后，标的公司成为公司全资子公司，有利于扩大标的公司在电子政务领域的产品及技术优势。,因赛集团：拟2.35亿元获取天与空51%股权,因赛集团（300781）6月15日晚公告，公司拟以21459.99万元收购上海天与空广告股份有限公司（简称“天与空”）48.78%股权，并拟以2000万元认缴天与空新增注册资本68.19万元，最终合计持有天与空51.01%的股权，此次交易金额为23459.99万元。通过对天与空的投资，公司可进一步完善在上海、华东地区的业务布局。,【再融资】,东方日升：拟发行不超过33亿元可转债,东方日升（300118）6月15日晚间公告，公司拟发行可转债募资不超过人民币33亿元，用于东方日升新能源股份有限公司年产2.5GW高效太阳能电池组件生产项目、东方日升（浙江）新能源有限公司年产5GW高效太阳能电池组件生产项目（一期）以及东方日升新能源股份有限公司全球高效太阳能电池组件创新中心项目。,安图生物：拟定增募资不超32.8亿元,安图生物（603658）6月15日晚间公告，拟定增募资不超32.8亿元，将用于安图生物体外诊断产业园（三期）项目、安图生物诊断仪器产业园之营销网络建设项目、补充流动资金。,贵州燃气：拟公开发行不超10亿元可转债,贵州燃气（600903）6月15日晚间公告，拟发行可转债募资不超10亿元，将用于城市燃气管网建设项目、习酒镇至习水县城天然气输气管道项目、天然气基础设施互联互通重点工程（贵阳市天然气储备及应急调峰设施建设项目）、偿还银行借款。,三角防务：拟发行不超9.04亿元可转债,三角防务（300775）6月15日晚披露公开发行可转债预案，发行总额不超过9.04亿元，扣除发行费用后，将全部投资于先进航空零部件智能互联制造基地项目。,上海天洋：拟定增募资不超6.8亿元,上海天洋（603330）6月15日晚披露非公开发行股票预案，募集资金总额不超6.8亿元，将全部用于高档新型环保墙布及产业用功能性面料生产项目、热熔粘接材料项目、补充流动资金。公司同时披露，拟收购烟台泰盛精化科技有限公司65%股权，泰盛精化是一家以工业用高端胶粘剂研发、生产、销售为一体的高新技术企业，整体估值约为8700万元左右。,【股权变动】,中新药业：天津市医药集团开展混改 拟通过股权转让引入投资者,中新药业（600329）6月15日晚间公告，公司收到控股股东天津市医药集团通知，其控股股东渤海国资拟于6月16日将其持有的天津市医药集团股权在天津产权交易中心进行产权转让项目信息预披露，转让比例不低于65%。天津市医药集团开展国有企业混合所有制改革拟通过股权转让形式引入投资者，导致其股权结构发生重大变化，可能将会导致公司的实际控制人发生变更。,数知科技：控股股东、实控人协议转让5.12%股份,数知科技（300038）6月15日晚公告，公司控股股东上海诺牧，实际控制人张志勇、张敏签订股份转让协议，以8.12元/股的价格，分别向焦鸣转让1750万股、350万股和3900万股股份，合计6000万股，占公司总股本5.12%。通过协议转让方式引入战略合作伙伴，有利于加速公司产业布局。数知科技同时公告，上海诺牧计划在2020年7月10日至2021年1月9日期间，减持不超公司总股本的1%。,【增减持】,晶方科技：大基金减持公司1%股权 减持计划已实施完毕,晶方科技（603005）6月15日晚间公告，大基金通过集中竞价方式减持公司1%股权，其减持计划已实施完毕。,长源电力：湖北能源增持1%股份,长源电力（000966）6月15日晚公告，湖北能源集团股份有限公司于5月25日至6月12日期间，通过集中竞价方式增持1108万股，占公司总股本的1%。此次变动后，湖北能源持有股份比例上升至12.8%。,新美星：控股股东方面拟减持不超6%股份,新美星（300509）6月15日晚公告，公司控股股东、实控人何德平、何云涛及其一致行动人德运公司，计划在15个交易日后的6个月内累计减持不超1368万股，即不超过公司总股本比例的6%。,昆仑万维：股东李琼拟减持不超6%股份,昆仑万维（300418）6月15日晚公告，为优化公司股东结构，维护公司长期战略稳定，同时调整个人资产结构配置，公司持股17.05%的股东李琼，计划在未来6个月内减持不超6893万股，不超过公司总股本的6%。,华通热力：股东拟减持不超3.70%股份,华通热力（002893）6月15日晚公告，持股3.70%的特定股东昆仑朝阳投资，计划3个交易日后的六个月内减持不超584万股，占公司总股本3.70%。,强力新材：股东拟减持不超3%股份,强力新材（300429）6月15日晚公告，持股5%的股东长城资本，计划在7月10日至10月31日期间，减持其通过设立长城资本管理有限公司—长城资本瑞鑫2号集合资产管理计划持有的公司1546万股，占公司总股本比例3%。,立华股份：股东拟减持不超3%公司股份,立华股份（300761）6月15日晚间公告，股东艾伯艾桂（持股比例6.67%）自公告之日起15个交易日后的3个月内，拟大宗交易或集中竞价交易方式减持不超过1212万股，即不超过公司总股本的3.00%。,金财互联：实控人拟减持不超2.10%股份,金财互联（002530）6月15日晚公告，公司实际控制人朱文明，计划在未来6个月内减持不超1640万股，占公司总股本比例2.10%。减持股份所得资金将用于降低控股股东东润金财的股票质押率，合理控制东润金财负债率。,和胜股份：股东拟合计减持不超2%公司股份,和胜股份（002824）6月15日晚间公告，股东霍润（持股比例10.50%）与黄嘉辉（持股比例5.19%）计划自公告发布之日起15个交易日后的六个月内，以集中竞价交易方式减持公司股份合计数量不超过367万股（即不超过公司总股本的2%）。,汇顶科技：汇发国际拟减持不超2%股权,汇顶科技（603160）6月15日晚间公告，持股9.29%的汇发国际，自2020年7月10日起至2021年1月5日，拟减持公司股份不超过总股本的2%。,鱼跃医疗：控股股东大宗交易减持1.995%股份,鱼跃医疗（002223）6月15日晚公告，控股股东鱼跃科技于6月12日及6月15日通过大宗交易的方式合计减持2000万股，占公司总股本的1.995%。,晨化股份：股东拟减持不超1.33%股份,晨化股份（300610）6月15日晚公告，持股1.74%的股东中比基金因自身经营需求，拟在未来6个月内减持不超200万股，即不超过公司目前总股本的1.33%。,南大光电：股东上海同华近期减持1.19%股份,南大光电（300346）6月15日晚披露股东上海同华的减持进展称，4月30日至6月15日期间，上海同华累计减持476万股，占公司总股本的1.19%。此次股份减持后，上海同华持股比例下降至5.05%。上海同华股份减持计划尚未实施完毕。,力星股份：股东拟减持不超0.72%公司股份,力星股份（300421）6月15日晚间公告，股东时艳芳（持股比例5.2%）自公告之日起3个交易日后的6个月内，拟以大宗交易方式减持公司股份不超过175万股，占公司总股本的0.72%。,【经营数据】,中国国航：5月旅客周转量环比上升49.6%,中国国航（601111）6月15日晚间公告，5月集团各主要生产指标同比下降、环比上升。客运运力投入（按可用座位公里计）同比下降63.3%，环比上升45%；旅客周转量（按收入客公里计）同比下降69.1%，环比上升49.6%。,南方航空：5月旅客周转量同比下降61.38%,南方航空（600029）6月15日晚间公告，5月集团客运运力投入（按可利用座公里计）同比下降52.94%；旅客周转量（按收入客公里计）同比下降61.38%；客座率为66.8%，同比下降14.61个百分点。,汉威科技：上半年净利预增30%-50%,汉威科技（300007）6月15日晚发布业绩预告，预计上半年净利为1.13亿元-1.3亿元，同比增长30%-50%。报告期内，虽然受到新冠病毒肺炎疫情影响，公司开工较往年略有延迟，但便携式测温枪、呼吸机等产品市场需求大幅上升，公司生产的热电堆温度传感器、MEMS气体流量传感器等产品销量出现大幅增长，带动传感器事业板块整体业务良好发展，为公司当期业绩增长做出了重大贡献。,【中标合同】,中国建筑：1-5月新签合同额10798亿元 同比增3.5%,中国建筑（601668）6月15日晚间公告，1-5月新签合同总额10798亿元，同比增长3.5%。,中国中冶：1-5月新签合同额3230.9亿元 同比增长7.9%,中国中冶（601618）6月15日晚间公告，公司1-5月新签合同额3230.9亿元，较上年同期增长7.9%。,【重大投资】,天康生物：与永昌县人民政府签署100万头生猪养殖项目框架协议,天康生物（002100）6月15日晚间公告，公司近日与甘肃省永昌县人民政府签署协议，公司计划在永昌县的投资项目以全产业链模式进行战略布局，项目建设规划100万头生猪养殖项目、30万吨专用猪饲料加工项目和50—100万头/年生猪屠宰及肉制品加工项目，项目概算总投资20亿元。,云海金属：子公司拟2.2亿元投建镁合金等项目,云海金属（002182）6月15日晚公告，子公司博奥镁铝拟投资建设年产2万吨镁合金、8000吨镁粒子和100万件镁铝合金中大型汽车零部件的项目，投资总额2.2亿元。项目达产后，预计实现年净利润为5113万元，投资回收期为4.81年（含建设期）。,摩恩电气：2000万元入股汇芯通信 后者专注5G通信领域前沿技术的研发,摩恩电气（002451）6月15日晚公告，公司计划以现金的形式向深圳市汇芯通信技术有限公司投资2000万元，持股比例4.87%。汇芯通信是专注于5G通信领域前沿技术和共性关键技术的研发供给、转移扩散和首次商业化的高科技公司。本次投资汇芯通信，利用其在5G行业的优势，有助于公司积极布局未来时速380公里及以上高铁、5G、军工等领域所需要的特种电缆。,【其他】,东阳光：子公司产品重组人胰岛素注射剂获药品注册批件,东阳光（600673）6月15日晚间公告，公司控股子公司东阳光药，收到国家药监局核准签发的《药品注册批件》。药品名称为重组人胰岛素注射剂。重组人胰岛素注射剂为东阳光药首个获批上市的生物制品药物，有利于拓展公司内分泌及代谢治疗领域业务，进一步丰富公司的产品组合。,华邦健康：子公司药品异烟肼片通过仿制药一致性评价,华邦健康（002004）6月15日晚公告，公司全资子公司华邦制药于近日收到国家药品监督管理局核准签发的关于异烟肼片的《药品补充申请批件》，该药品通过国家仿制药质量和疗效一致性评价。异烟肼片与其他抗结核药物联合，适用于对异烟肼敏感的各型结核病治疗。,迪瑞医疗：获得第一类医疗器械备案凭证,迪瑞医疗（300396）6月15日晚公告，公司于近日取得由长春市市场监督管理局颁发的1项《第一类医疗器械备案凭证》，涉及产品核酸提取试剂盒（磁珠法）。上述产品用于核酸的提取、富集、纯化等步骤，可进行手工提取或仪器提取。其处理后的产物用于临床体外检测使用。,中信银行：全资子公司信银理财获准开业,中信银行（601998）6月15日晚间公告，中国银保监会已批准公司全资子公司信银理财有限责任公司开业。根据中国银保监会批复，信银理财注册资本为50亿元，注册地为上海市，主要从事发行公募理财产品、发行私募理财产品、理财顾问和咨询等资产管理相关业务。,欣旺达：欣旺达电动汽车通过ASPICE CL2国际认证,欣旺达（300207）6月15日晚公告，公司的全资子公司欣旺达电动汽车于近日进行了ASPICE CL2软件研发能力评估并成功通过。该成果标志着欣旺达电动汽车的车规级软件研发能力的进一步提升，也是欣旺达电动汽车在软件研发管理改善上取得的阶段性成果。欣旺达电动汽车引入ASPICE标准旨在改善欣旺达电动汽车在动力电池BMS方面的研发管理，有助于加快海外车厂客户对欣旺达电动汽车研发能力的认可。,比亚迪：同意比亚迪半导体与小米长江产业基金等战投签署投资协议,比亚迪（002594）15日晚公告，6月15日，比亚迪召开第六届董事会第三十九次会议，同意公司及比亚迪半导体与湖北小米长江产业基金合伙企业（有限合伙）、湖北省联想长江科技产业基金合伙企业（有限合伙）等签署《投资协议》、《股东协议》及其附件和相关补充协议（若有）。本轮投资者按照目标公司的投前估值75亿元，拟向比亚迪半导体合计增资近8亿元。本轮投资者合计将取得比亚迪半导体增资扩股后7.843%股权。,责任编辑：陈志杰",https://finance.sina.com.cn/stock/s/2020-06-15/doc-iirczymk7172587.shtml,sinaStock
1,2020-06-15 21:00:00,金科股份：关于董事辞职的公告,"金科地产集团股份有限公司,关于董事辞职的公告 证券简称：金科股份      证券代码：000656        公告编号：2020-104 号,本公司及董事会全体成员保证信息披露内容的真实、准确、完整，没有 虚假记载、误导性陈述或重大遗漏。,金科地产集团股份有限公司（以下简称“公司”）董事会于近日收到经公司股东天津聚金物业管理有限公司提名的董事张强先生递交的关于辞任董事职务的书面通知函。张强先生因个人原因辞去公司董事及提名委员会委员职务，并对其任职期间公司董事会其他董事、监事及高级管理人员对其工作的大力支持表示感谢。辞职以后，张强先生不再担任公司任何职务。,张强先生的辞职未导致公司董事会人数低于法定的最低人数要求，根据《中华人民共和国公司法》和《公司章程》的相关规定，其辞职自相关书面通知函送达公司董事会时生效。,截至本公告披露日，张强先生未持有公司股份。张强先生在担任公司董事期间忠实诚信，恪尽职守。公司董事会对张强先生做出的贡献表示衷心感谢！,特此公告,金科地产集团股份有限公司,董   事   会,二○二○年六月十五日,责任编辑：小浪快报",https://finance.sina.com.cn/stock/ggzz/2020-06-15/doc-iirczymk7169998.shtml,sinaStock
